{"apiVersion":"specguard.cli-check-baseline-review/v1alpha1","binding":{"baseOid":"9d52836935974f0c81141d33579d9d5b98e0e8c2","candidateOid":"9d52836935974f0c81141d33579d9d5b98e0e8c2","objectFormat":"sha1"},"finishedAt":"2026-10-09T10:00:01Z","invocation":{"base_oid":"9d52836935974f0c81141d33579d9d5b98e0e8c2","baseline_digest":"sha256:16a963d692b2390215ff42cd085989639bc9226c3f9d7463ac58a117b3640ae7","candidate_oid":"9d52836935974f0c81141d33579d9d5b98e0e8c2","merge_group_id":null,"repo_id":"fixture-repository","run_id":"sg-attempt-1","started_at":"2026-10-09T10:00:00Z","task_id":"task-1","worktree_id":"worktree-1"},"mapping":{"contract":{"apiVersion":"guard.partme.ai/v1alpha1","kind":"GuardContract","metadata":{"id":"protected","revision":"1"},"spec":{"rules":[{"assertion":{"object":"finding-0","predicate":"spec_violation","subject":"demo:R1","type":"forbid_relation"},"description":"fixture protected mapping","enforcement":"enforce","id":"rule-0"},{"assertion":{"object":"finding-1","predicate":"spec_violation","subject":"demo:R1","type":"forbid_relation"},"description":"fixture protected mapping","enforcement":"enforce","id":"rule-1"},{"assertion":{"object":"finding-2","predicate":"spec_violation","subject":"demo:R1","type":"forbid_relation"},"description":"fixture protected mapping","enforcement":"enforce","id":"rule-2"},{"assertion":{"object":"finding-3","predicate":"spec_violation","subject":"demo:R1","type":"forbid_relation"},"description":"fixture protected mapping","enforcement":"enforce","id":"rule-3"}]}},"entries":[{"key":{"id":"R1","namespace":"demo"},"kind":"duplicate","object":"finding-0","predicate":"spec_violation","ruleId":"rule-0","subject":"demo:R1"},{"key":{"id":"R1","namespace":"demo"},"kind":"missing_requirement","object":"finding-1","predicate":"spec_violation","ruleId":"rule-1","subject":"demo:R1"},{"key":{"id":"R1","namespace":"demo"},"kind":"missing_acceptance","object":"finding-2","predicate":"spec_violation","ruleId":"rule-2","subject":"demo:R1"},{"key":{"id":"R1","namespace":"demo"},"kind":"broken_reference","object":"finding-3","predicate":"spec_violation","ruleId":"rule-3","subject":"demo:R1"}]},"required":[{"id":"R1","namespace":"demo"}],"review":{"apiVersion":"specguard.baseline-review/v1","baseline":{"apiVersion":"specguard.domain/v1alpha1","approvalRef":"fixture:approval-1","effectiveFrom":10,"expiresAt":100,"graph":{"parsed":{"acceptances":[{"key":{"id":"A1","namespace":"demo"},"requirement":{"id":"R1","namespace":"demo"},"source":{"line":7,"path":"specs/a.md"},"text":"A correct password opens a session."}],"apiVersion":"specguard.domain/v1alpha1","candidateOid":"9d52836935974f0c81141d33579d9d5b98e0e8c2","edges":[],"requirements":[{"key":{"id":"R1","namespace":"demo"},"source":{"line":5,"path":"specs/a.md"},"text":"A user can sign in."}],"snapshotDigest":"sha256:f41302424dfc1e229007cfafaf6713f4202b86d271eb13a984d75f7c00d6570b","sources":[{"path":"specs/a.md","reason":"parsed","status":"complete"}]}},"graphDigest":"sha256:75e2feb44911a91aace18079a5a7e0e469036629a7d5f0af6e8ac4c4fe57d76e","policyDigest":"sha256:aaaaaaaaaaaaaaaaaaaaaaaaaaaaaaaaaaaaaaaaaaaaaaaaaaaaaaaaaaaaaaaa","repository":"fixture-repository","scope":[{"id":"R1","namespace":"demo"}],"sourceDigest":"sha256:f41302424dfc1e229007cfafaf6713f4202b86d271eb13a984d75f7c00d6570b","sourceRevision":"9d52836935974f0c81141d33579d9d5b98e0e8c2","state":"approved"},"contract":{"apiVersion":"guard.partme.ai/v1alpha1","kind":"GuardContract","metadata":{"id":"protected","revision":"1"},"spec":{"rules":[{"assertion":{"object":"text_review","predicate":"baseline_change","subject":"demo:R1","type":"forbid_relation"},"description":"fixture protected mapping","enforcement":"review","id":"review-text"},{"assertion":{"object":"acceptance_review","predicate":"baseline_change","subject":"demo:R1","type":"forbid_relation"},"description":"fixture protected mapping","enforcement":"review","id":"review-acceptance"}]}},"rules":[{"key":{"id":"R1","namespace":"demo"},"kind":"text_review","object":"text_review","predicate":"baseline_change","ruleId":"review-text","subject":"demo:R1"},{"key":{"id":"R1","namespace":"demo"},"kind":"acceptance_review","object":"acceptance_review","predicate":"baseline_change","ruleId":"review-acceptance","subject":"demo:R1"}]},"sourcePolicy":{"apiVersion":"specguard.domain/v1alpha1","limits":{"maxBytes":1048576,"maxDepth":16,"maxFiles":1000,"maxLines":10000,"maxMillis":5000},"roots":[{"authority":"primary","format":"markdown-explicit/v1","namespace":"demo","path":"specs"}]}}